{
  "bridge_type": "continuous_girder",
  "material": "prestressed_concrete",
  "spans_m": [
    40,
    70,
    40
  ],
  "deck_width_m": 7.5,
  "alignment_type": "straight",
  "start_station": "K0+000",
  "superstructure": {
    "section_type": "single_box_single_cell",
    "girder_depth_policy": "auto"
  },
  "substructure": {
    "pier_type": "double_column",
    "abutment_type": "gravity"
  },
  "requested_drawings": [
    "general_arrangement",
    "plan",
    "elevation",
    "typical_section"
  ],
  "assumptions": [
    "Alignment is straight.",
    "Section type is single-box single-cell.",
    "Pier type defaults to double-column.",
    "Abutment type defaults to gravity."
  ],
  "questions": []
}

